{
  "artifacts": {
    "rationale-packet.json": "c22299c8b58a0492139f8602aef98cca1c4c1b3a2aa7e2dc834c14e63b32cc1b",
    "rationale.json": "15e53190ca4d0a6fb85dca3cac528f40130903621421f97db66102724ead3679",
    "rationale.md": "7bcd319e9b9cf4ca09dcd5b6034b67e9be53ab57e94043926aa98cded627a8c4"
  },
  "packet_sha256": "c22299c8b58a0492139f8602aef98cca1c4c1b3a2aa7e2dc834c14e63b32cc1b",
  "run_id": "rationale-selected",
  "schema_version": 1,
  "source_publication_receipt_sha256": "e2675b861a53db0293df1d9fafa7f9030fdb6d84a60cdc5060f3f17425737559"
}
